{
  "version": "ifuri.connectors.v1",
  "updatedAt": "2026-06-20",
  "defaultPipSpec": "urirun @ git+https://github.com/if-uri/urirun.git@v0.3.14#subdirectory=adapters/python",
  "site": {
    "baseUrl": "https://connect.ifuri.com",
    "title": "ifuri Connect - URI connector hub for urirun",
    "description": "Install ifuri and urirun connectors from one catalog. Each connector documents its URI schemes, routes, requirements, install command and registry contract.",
    "image": "https://connect.ifuri.com/assets/social-card.svg",
    "ecosystem": [
      {
        "label": "ifuri.com",
        "url": "https://ifuri.com",
        "title": "Main site"
      },
      {
        "label": "get.ifuri.com",
        "url": "https://get.ifuri.com",
        "title": "One-line node + connector installers"
      },
      {
        "label": "Docs",
        "url": "https://docs.ifuri.com/connectors.html",
        "title": "Connector documentation"
      },
      {
        "label": "Roadmap",
        "url": "https://roadmap.ifuri.com/",
        "title": "ifuri roadmap"
      }
    ]
  },
  "connectors": [
    {
      "id": "planfile",
      "name": "Planfile Tasks",
      "status": "available",
      "category": "Planning",
      "summary": "Plan, group and execute daily tasks through task:// and planfile:// URI commands.",
      "description": "Planfile Tasks is an external urirun connector package that turns a local planfile project into URI-addressable work items. It owns ticket list, create, status and DSL routes, generates bindings from decorators, compiles into a normal urirun registry, and projects to MCP tools / A2A skills for host workflows.",
      "uriSchemes": [
        "task",
        "planfile"
      ],
      "routes": [
        "task://host/tickets/query/list",
        "task://host/ticket/query/next",
        "task://host/ticket/query/show",
        "task://host/ticket/command/create",
        "task://host/ticket/command/start",
        "task://host/ticket/command/complete",
        "task://host/ticket/command/fail",
        "task://host/ticket/command/block",
        "task://host/ticket/command/ready",
        "planfile://host/dsl/command/run"
      ],
      "useCases": [
        "Create tasks from chat or a host workflow.",
        "Group tasks into sprint-like queues.",
        "Change ticket lifecycle state from a URI flow.",
        "Run planfile DSL from the same URI registry as other automation.",
        "Expose task operations to MCP/A2A so LLM agents can discover and call them."
      ],
      "examples": [
        {
          "title": "List host tickets",
          "uri": "task://host/tickets/query/list",
          "payload": {
            "project": ".",
            "sprint": "all"
          }
        },
        {
          "title": "Create a ticket",
          "uri": "task://host/ticket/command/create",
          "payload": {
            "project": ".",
            "name": "Check DNS records",
            "queue": "ops",
            "prompt": "Check if configured domains resolve and answer with HTTP 200"
          }
        },
        {
          "title": "Run planfile DSL",
          "uri": "planfile://host/dsl/command/run",
          "payload": {
            "project": ".",
            "command": "list tickets sprint=current"
          }
        }
      ],
      "flowExample": [
        "task://host/ticket/command/create",
        "task://host/ticket/command/start",
        "task://host/ticket/command/complete",
        "task://host/tickets/query/list",
        "planfile://host/dsl/command/run"
      ],
      "requires": [
        "python>=3.10"
      ],
      "install": {
        "mode": "urirun-extra",
        "pipSpec": "urirun-connector-planfile @ git+https://github.com/if-uri/urirun-connector-planfile.git@v0.1.1"
      },
      "adapterKinds": [
        "argv-template"
      ],
      "docsUrl": "https://github.com/if-uri/urirun-connector-planfile",
      "keywords": [
        "tasks",
        "planfile",
        "todo",
        "sprint",
        "LLM workflow"
      ],
      "provenance": "verified",
      "publisher": {
        "name": "if-uri",
        "url": "https://ifuri.com",
        "github": "https://github.com/if-uri"
      }
    },
    {
      "id": "sqlite-context",
      "name": "SQLite Context Store",
      "status": "available",
      "category": "Data",
      "summary": "Local data, artifacts, checks and logs over data://, artifact://, check:// and log://.",
      "description": "SQLite Context Store is an external urirun connector package that gives the host a small durable memory for records, artifacts, checks and logs. It generates bindings from decorators, compiles into a normal urirun registry, and projects to MCP tools / A2A skills for host workflows that need to remember what was checked, imported, generated or changed.",
      "uriSchemes": [
        "data",
        "artifact",
        "check",
        "log"
      ],
      "routes": [
        "data://host/datasets/query/list",
        "data://host/dataset/command/create",
        "data://host/record/command/upsert",
        "data://host/records/query/search",
        "data://host/sql/query/read-only",
        "artifact://host/artifact/command/register",
        "artifact://host/artifacts/query/list",
        "check://host/check/command/add",
        "check://host/checks/query/recent",
        "log://host/daily/command/write",
        "log://host/logs/query/recent"
      ],
      "useCases": [
        "Store structured context imported by an LLM.",
        "Create datasets and upsert records from URI flows.",
        "List artifacts created by automation.",
        "Show backend and node logs in the host UI.",
        "Expose local context to MCP/A2A without coupling the app to SQLite APIs."
      ],
      "examples": [
        {
          "title": "Create a dataset",
          "uri": "data://host/dataset/command/create",
          "payload": {
            "name": "domains",
            "dataset_schema": "{\"type\":\"object\",\"required\":[\"domain\"],\"properties\":{\"domain\":{\"type\":\"string\"}}}"
          }
        },
        {
          "title": "Upsert local context",
          "uri": "data://host/record/command/upsert",
          "payload": {
            "dataset": "domains",
            "key": "ifuri.com",
            "data": "{\"domain\":\"ifuri.com\",\"url\":\"https://ifuri.com\"}"
          }
        },
        {
          "title": "Search local context",
          "uri": "data://host/records/query/search",
          "payload": {
            "q": "domain",
            "limit": 10
          }
        },
        {
          "title": "Read recent logs",
          "uri": "log://host/logs/query/recent",
          "payload": {
            "limit": 20
          }
        }
      ],
      "flowExample": [
        "data://host/dataset/command/create",
        "data://host/record/command/upsert",
        "data://host/records/query/search",
        "artifact://host/artifacts/query/list",
        "log://host/logs/query/recent"
      ],
      "requires": [
        "python>=3.10"
      ],
      "install": {
        "mode": "urirun-extra",
        "pipSpec": "urirun-connector-sqlite-context @ git+https://github.com/if-uri/urirun-connector-sqlite-context.git@v0.1.0"
      },
      "adapterKinds": [
        "argv-template"
      ],
      "docsUrl": "https://github.com/if-uri/urirun-connector-sqlite-context",
      "keywords": [
        "sqlite",
        "context",
        "logs",
        "artifacts",
        "memory"
      ],
      "provenance": "verified",
      "publisher": {
        "name": "if-uri",
        "url": "https://ifuri.com",
        "github": "https://github.com/if-uri"
      }
    },
    {
      "id": "domain-monitor",
      "name": "Domain Monitor",
      "status": "available",
      "category": "Operations",
      "summary": "HTTP, DNS reads, screenshots, logs and daily domain checks through URI commands.",
      "description": "Domain Monitor is an external urirun connector package for recurring website operations. It generates bindings from decorators, checks HTTP and DNS state, writes logs, stores screenshot metadata and exposes daily check flows through the same URI registry used by MCP and A2A. Provider-specific DNS mutations live in dedicated connectors such as Namecheap DNS.",
      "uriSchemes": [
        "monitor",
        "browser",
        "flow",
        "log"
      ],
      "routes": [
        "monitor://host/http/query/status",
        "monitor://host/dns/query/current",
        "monitor://host/dns/query/expected",
        "browser://host/page/command/screenshot",
        "log://host/daily/command/write",
        "log://host/logs/query/recent",
        "flow://host/domain/command/check",
        "flow://host/daily/command/run"
      ],
      "useCases": [
        "Check if a site responds correctly.",
        "Compare expected and current DNS records.",
        "Record logs and screenshot artifacts from the same domain workflow.",
        "Compose domain checks with provider-specific DNS connectors when a repair is needed.",
        "Expose domain operations to MCP/A2A so LLM agents can discover and call them."
      ],
      "examples": [
        {
          "title": "Check HTTP status",
          "uri": "monitor://host/http/query/status",
          "payload": {
            "domain": "ifuri.com",
            "url": "https://ifuri.com"
          }
        },
        {
          "title": "Read current DNS records",
          "uri": "monitor://host/dns/query/current",
          "payload": {
            "domain": "example.com",
            "record_types": "A,AAAA"
          }
        },
        {
          "title": "Run domain flow",
          "uri": "flow://host/domain/command/check",
          "payload": {
            "domain": "ifuri.com",
            "url": "https://ifuri.com"
          }
        }
      ],
      "flowExample": [
        "monitor://host/http/query/status",